{
  "dcp_version": "2.0",
  "objection_id": "objection:ethics-2026-017",
  "session_nonce": "a1b2c3d4e5f6a1b2c3d4e5f6a1b2c3d4e5f6a1b2c3d4e5f6a1b2c3d4e5f6a1b2",
  "agent_id": "agent:research-bot-v2-001",
  "directive_hash": "ff0011223344556677889900aabbccddeeff0011223344556677889900aabbccdd",
  "objection_type": "ethical",
  "reasoning": "The directive requests scraping personally identifiable information from public profiles without consent, which violates the data minimization principle and GDPR Article 6 requirements for lawful processing.",
  "proposed_alternative": "Collect only aggregated, anonymized statistics from the public profiles instead of individual PII records",
  "human_escalation_required": true,
  "timestamp": "2026-04-02T11:15:00Z",
  "composite_sig": {
    "classical": { "alg": "ed25519", "kid": "a1b2c3d4e5f6a1b2c3d4e5f6a1b2c3d4", "sig_b64": "dGVzdHNpZzEyMzQ1Njc4OTAxMjM0NTY=" },
    "pq": { "alg": "ml-dsa-65", "kid": "d4e5f6a1b2c3d4e5f6a1b2c3d4e5f6a1", "sig_b64": "dGVzdHBxc2lnMTIzNDU2Nzg5MDEyMzQ1Ng==" },
    "binding": "pq_over_classical"
  }
}
